{
  "protocol_version": "consenti/v0.1",
  "agreement_id": "01JBQX7K8M3NVWDP5T6ZYRHA42",
  "created_at": "2026-04-16T09:14:00Z",
  "publisher": {
    "identifier": {
      "type": "domain",
      "value": "anytech365.com"
    },
    "display_name": "AnyTech365"
  },
  "acceptor": {
    "acceptor_type": "human",
    "identifier": {
      "type": "email",
      "value": "john.smith@example.com"
    },
    "display_name": "John Smith",
    "accepted_at": "2026-04-16T09:14:00Z",
    "ip_address": "203.0.113.42",
    "user_agent": "Mozilla/5.0 (Macintosh; Intel Mac OS X 10_15_7)"
  },
  "terms_ref": {
    "terms_hash": "sha256:3f2a7b9c1d4e8f0a2b5c6d7e8f9a0b1c2d3e4f5a6b7c8d9e0f1a2b3c4d5e6f7a",
    "terms_url": "https://anytech365.com/.well-known/agreements/tos-v4.json",
    "terms_version": "v4",
    "terms_title": "Terms of Service"
  },
  "acceptance_method": "checkbox_click",
  "proof_of_understanding": null,
  "jurisdiction": {
    "governing_law": "ES",
    "legal_basis": [
      "UETA-14",
      "ESIGN-7001"
    ]
  },
  "anchoring": {
    "method": "pangea",
    "chain_id": null,
    "transaction_ref": "pgn_tx_a1b2c3d4e5f6",
    "anchored_at": "2026-04-16T09:14:05Z",
    "agreement_hash": "sha256:83079b0260d1b682719241114e57c6a8b2401792b682f3f348eccb17ea9ca037"
  },
  "signatures": null,
  "privacy": {
    "model": "public"
  },
  "canonicalization": {
    "method": "RFC8785",
    "hash_algorithm": "SHA-256",
    "excluded_fields": [
      "anchoring",
      "signatures",
      "privacy.anchor_commitment",
      "privacy.merkle_tree.root"
    ]
  }
}
